<?xml version="1.0" encoding="UTF-8"?>
<orders
    xmlns:xsi="http://www.w3.org/2001/XMLSchema-instance" 
    xsi:noNamespaceSchemaLocation="HTDONHANG.xsd"> <order id="O001">
    <!--khai báo namespace
    xmlns:xsi định nghĩa một prefix (tiền tố) xsi.
    http://www.w3.org/2001/XMLSchema-instance là đường dẫn chuẩn W3C dành riêng cho XML Schema Instance.
    -->

        <product id="P001">
            <name>Điện thoại iPhone</name>
            <quantity>2</quantity>
        </product>
        <product id="P002">
            <name>Laptop Dell</name>
            <quantity>1</quantity>
        </product>
    </order>
    <order id="O002">
        <product id="P003">
            <name>Máy ảnh Canon</name>
            <quantity>3</quantity>
        </product>
        <product id="P004">
            <name>Tai nghe</name>
            <quantity>5</quantity>
        </product>
    </order>
    <shipment orderRef="O001" shipper="Giao Hàng Nhanh"/>
    <shipment orderRef="O002" shipper="Viettel Post"/>
</orders>